{
  "schemaVersion": 1,
  "hosts": {
    "claude": {
      "displayName": "Claude Code",
      "packagePath": "plugins/claude",
      "nativeHarnesses": [
        "claude"
      ]
    },
    "codex": {
      "displayName": "Codex",
      "packagePath": "plugins/codex",
      "nativeHarnesses": [
        "codex"
      ]
    },
    "copilot": {
      "displayName": "GitHub Copilot CLI",
      "packagePath": "plugins/copilot",
      "nativeHarnesses": []
    }
  },
  "harnesses": {
    "codex": {
      "displayName": "OpenAI Codex",
      "shim": "codex-shim.sh",
      "binaryCandidates": [
        "codex"
      ],
      "binaryOverrideEnv": "CODEX_BIN",
      "harnessKind": "model-bound",
      "endpointDelivery": "none",
      "nativeHosts": [
        "codex"
      ],
      "promptDelivery": "stdin",
      "allowUnknownModels": true,
      "defaultModel": {
        "source": "codex-config",
        "fallback": "codex-default"
      },
      "modelSelectors": [
        "-m",
        "--model",
        "model="
      ],
      "effort": {
        "kind": "config",
        "key": "model_reasoning_effort",
        "values": [
          "none",
          "minimal",
          "low",
          "medium",
          "high",
          "xhigh",
          "max"
        ]
      },
      "capabilities": {
        "authProbe": true,
        "configProbe": false,
        "worktreeDispatch": true,
        "structuredOutput": false
      },
      "models": {
        "gpt-5.6-sol": {
          "displayName": "GPT-5.6 Sol",
          "aliases": [],
          "effortValues": [
            "none",
            "low",
            "medium",
            "high",
            "xhigh",
            "max"
          ],
          "promptReference": "docs/prompting/openai-codex-gpt-prompting-reference.md",
          "runtimeReference": "references/model-prompting.md#openai-gpt-6-through-codex",
          "capabilityCard": "plugins/claude/skills/subagent-model-routing/ledger/codex.md",
          "provenance": "model-facts:families/codex"
        },
        "gpt-5.6-terra": {
          "displayName": "GPT-5.6 Terra",
          "aliases": [],
          "effortValues": [
            "none",
            "low",
            "medium",
            "high",
            "xhigh",
            "max"
          ],
          "promptReference": "docs/prompting/openai-codex-gpt-prompting-reference.md",
          "runtimeReference": "references/model-prompting.md#openai-gpt-6-through-codex",
          "capabilityCard": "plugins/claude/skills/subagent-model-routing/ledger/codex.md",
          "provenance": "model-facts:families/codex"
        },
        "gpt-5.6-luna": {
          "displayName": "GPT-5.6 Luna",
          "aliases": [],
          "effortValues": [
            "none",
            "low",
            "medium",
            "high",
            "xhigh",
            "max"
          ],
          "promptReference": "docs/prompting/openai-codex-gpt-prompting-reference.md",
          "runtimeReference": "references/model-prompting.md#openai-gpt-6-through-codex",
          "capabilityCard": "plugins/claude/skills/subagent-model-routing/ledger/codex.md",
          "provenance": "model-facts:families/codex"
        },
        "gpt-6-astra": {
          "displayName": "GPT-6 Astra",
          "aliases": [],
          "effortValues": [
            "low",
            "medium",
            "high",
            "xhigh",
            "max"
          ],
          "promptReference": "docs/prompting/openai-codex-gpt-prompting-reference.md",
          "runtimeReference": "references/model-prompting.md#openai-gpt-6-through-codex",
          "capabilityCard": "plugins/claude/skills/subagent-model-routing/ledger/codex.md",
          "provenance": "model-facts:families/codex"
        },
        "gpt-6-luna": {
          "displayName": "GPT-6 Luna",
          "aliases": [],
          "effortValues": [
            "none",
            "low",
            "medium",
            "high",
            "xhigh",
            "max"
          ],
          "promptReference": "docs/prompting/openai-codex-gpt-prompting-reference.md",
          "runtimeReference": "references/model-prompting.md#openai-gpt-6-through-codex",
          "capabilityCard": "plugins/claude/skills/subagent-model-routing/ledger/codex.md",
          "provenance": "model-facts:families/codex"
        },
        "gpt-6.1-sol": {
          "displayName": "GPT-6.1 Sol",
          "aliases": [],
          "effortValues": [
            "low",
            "medium",
            "high",
            "xhigh",
            "max"
          ],
          "promptReference": "docs/prompting/openai-codex-gpt-prompting-reference.md",
          "runtimeReference": "references/model-prompting.md#openai-gpt-6-through-codex",
          "capabilityCard": "plugins/claude/skills/subagent-model-routing/ledger/codex.md",
          "provenance": "model-facts:families/codex"
        }
      },
      "routeFamilies": []
    },
    "claude": {
      "displayName": "Anthropic Claude Code",
      "shim": "claude-shim.sh",
      "binaryCandidates": [
        "claude"
      ],
      "binaryOverrideEnv": "CLAUDE_BIN",
      "harnessKind": "model-bound",
      "endpointDelivery": "none",
      "nativeHosts": [
        "claude"
      ],
      "promptDelivery": "stdin",
      "allowUnknownModels": true,
      "defaultModel": {
        "source": "registry",
        "fallback": "sonnet"
      },
      "modelSelectors": [
        "--model"
      ],
      "effort": {
        "kind": "harness-flag",
        "key": "--effort",
        "values": [
          "low",
          "medium",
          "high",
          "xhigh",
          "max"
        ]
      },
      "capabilities": {
        "authProbe": true,
        "configProbe": false,
        "worktreeDispatch": true,
        "structuredOutput": false
      },
      "models": {
        "sonnet": {
          "displayName": "Claude Sonnet 5.5",
          "aliases": [],
          "effortValues": [
            "low",
            "medium",
            "high",
            "xhigh",
            "max"
          ],
          "promptReference": "docs/prompting/anthropic-claude-sonnet-5-prompting-reference.md",
          "runtimeReference": "references/model-prompting.md#claude-sonnet-55",
          "capabilityCard": "plugins/claude/skills/subagent-model-routing/ledger/claude-sonnet-5.md",
          "provenance": "model-facts:families/claude-sonnet-5"
        },
        "opus": {
          "displayName": "Claude Opus 5.5",
          "aliases": [],
          "effortValues": [
            "low",
            "medium",
            "high",
            "xhigh",
            "max"
          ],
          "promptReference": "docs/prompting/anthropic-claude-opus-4.8-prompting-reference.md",
          "runtimeReference": "references/model-prompting.md#claude-opus-55",
          "capabilityCard": "plugins/claude/skills/subagent-model-routing/ledger/claude-opus-4.8.md",
          "provenance": "model-facts:families/claude-opus-4.8"
        },
        "fable": {
          "displayName": "Claude Fable 5.1",
          "aliases": [],
          "effortValues": [
            "low",
            "medium",
            "high",
            "xhigh",
            "max"
          ],
          "promptReference": "docs/prompting/anthropic-claude-fable-5-prompting-reference.md",
          "runtimeReference": "references/model-prompting.md#claude-fable-51",
          "capabilityCard": "plugins/claude/skills/subagent-model-routing/ledger/claude-fable-5.md",
          "provenance": "model-facts:families/claude-fable-5"
        },
        "haiku": {
          "displayName": "Claude Haiku 5.5",
          "aliases": [],
          "effortValues": [
            "low",
            "medium",
            "high",
            "xhigh",
            "max"
          ],
          "promptReference": "docs/prompting/anthropic-claude-haiku-5-prompting-reference.md",
          "runtimeReference": "references/model-prompting.md#claude-haiku-55",
          "capabilityCard": "plugins/claude/skills/subagent-model-routing/ledger/claude-haiku-5.md",
          "provenance": "model-facts:families/claude-haiku-5"
        }
      },
      "routeFamilies": []
    },
    "grok": {
      "displayName": "xAI Grok Build",
      "shim": "grok-shim.sh",
      "binaryCandidates": [
        "grok"
      ],
      "binaryOverrideEnv": "GROK_BIN",
      "harnessKind": "model-bound",
      "endpointDelivery": "none",
      "nativeHosts": [],
      "promptDelivery": "file",
      "allowUnknownModels": true,
      "defaultModel": {
        "source": "registry",
        "fallback": "grok-4.7"
      },
      "modelSelectors": [
        "-m",
        "--model"
      ],
      "effort": {
        "kind": "harness-flag",
        "key": "--effort",
        "values": [
          "low",
          "medium",
          "high",
          "xhigh"
        ]
      },
      "capabilities": {
        "authProbe": true,
        "configProbe": false,
        "worktreeDispatch": true,
        "structuredOutput": false
      },
      "models": {
        "grok-4.7": {
          "displayName": "Grok 4.7",
          "aliases": [],
          "effortValues": [
            "low",
            "medium",
            "high",
            "xhigh"
          ],
          "promptReference": "docs/prompting/xai-grok-prompting-reference.md",
          "runtimeReference": "references/model-prompting.md#xai-grok-47-through-grok-build",
          "capabilityCard": "plugins/claude/skills/subagent-model-routing/ledger/grok.md",
          "provenance": "model-facts:families/grok"
        }
      },
      "routeFamilies": []
    },
    "kimi": {
      "displayName": "Moonshot Kimi Code",
      "shim": "kimi-shim.sh",
      "binaryCandidates": [
        "kimi"
      ],
      "binaryOverrideEnv": "KIMI_BIN",
      "harnessKind": "model-bound",
      "endpointDelivery": "none",
      "nativeHosts": [],
      "promptDelivery": "argv",